<?xml version="1.0" encoding="UTF-8"?>

<!DOCTYPE rss SYSTEM "feed.dtd">

<rss version="2.0">
    <channel>
        <title>Ejemplo de Feed en RRSS</title>
        <link>http://www.ejemplo.com</link>
        <description>Este es un ejemplo de Feed en RRSS</description>
        <item>
            <title>Art√≠culo de ejemplo</title>
            <link>http://www.ejemplo.com/tarta-manzana</link>
            <description>Este es un ejemplo de Feed en RRSS</description>
            <pubDate>Mon, 06 Sep 2021 00:00:00 GMT</pubDate>
        </item>
    </channel>
</rss>
